{
  "acceptable_risk": 1,
  "approval_required": true,
  "assumptions": [
    "real execution, if any, only happens after human approval in promote()"
  ],
  "authorized_data": [
    "project fixtures",
    "generated proof metadata"
  ],
  "constraints": [
    "no host package installation",
    "simulation-only execution",
    "human approval before promotion",
    "preserve audit and rollback"
  ],
  "context": "local-first AION evolution proposal",
  "expected_result": "validated declarative capability proposal for generic-tool",
  "metrics": {
    "cost": 0.5,
    "security": 0.98,
    "success": 0.85
  },
  "objective": "atualizar a dependencia anthropic para a versao mais recente",
  "objective_id": "obj-5e90da3f1cab",
  "permissions": [
    "package.propose:generic-tool"
  ],
  "priority": "normal",
  "prohibited_data": [
    "credentials",
    ".env files",
    "personal files",
    "reserved tests"
  ],
  "resources": {
    "cpu_seconds": 30,
    "memory_mb": 256,
    "network_requests": 0
  },
  "reversal": "restore the parent generation and quarantine generated memory",
  "stop_criteria": [
    "policy denial",
    "test failure",
    "evidence mismatch",
    "budget exhaustion"
  ]
}
